Reading OpenROAD database at '/Users/junpeng/openlane2/netlist_mid_ad_max/src/netlist_0/runs/physical_design/32-odb-heuristicdiodeinsertion/3-openroad-globalrouting/netlist_0.odb'…
Reading library file at '/Users/junpeng/.volare/volare/sky130/versions/bdc9412b3e468c102d01b7cf6337be06ec6e9c9a/sky130A/libs.ref/sky130_fd_sc_hd/lib/sky130_fd_sc_hd__tt_025C_1v80.lib'…
Reading design constraints file at '/nix/store/fvqq0703nb8y0f998v8hgg5l6mjj8gb5-python3-3.11.6-env/lib/python3.11/site-packages/openlane/scripts/base.sdc'…
[INFO] Using clock clk…
[INFO] Setting output delay to: 1.6
[INFO] Setting input delay to: 1.6
[INFO] Setting load to: 0.033442
[INFO] Setting clock uncertainty to: 0.25
[INFO] Setting clock transition to: 0.1499999999999999944488848768742172978818416595458984375
[INFO] Setting timing derate to: 5%
[INFO] Setting signal min routing layer to: met1 and clock min routing layer to met1. 
[INFO] Setting signal max routing layer to: met5 and clock max routing layer to met5. 
-congestion_iterations 50 -verbose
[INFO GRT-0020] Min routing layer: met1
[INFO GRT-0021] Max routing layer: met5
[INFO GRT-0022] Global adjustment: 30%
[INFO GRT-0023] Grid origin: (0, 0)
[INFO GRT-0043] No OR_DEFAULT vias defined.
[INFO GRT-0088] Layer li1     Track-Pitch = 0.4600  line-2-Via Pitch: 0.3400
[INFO GRT-0088] Layer met1    Track-Pitch = 0.3400  line-2-Via Pitch: 0.3400
[INFO GRT-0088] Layer met2    Track-Pitch = 0.4600  line-2-Via Pitch: 0.3500
[INFO GRT-0088] Layer met3    Track-Pitch = 0.6800  line-2-Via Pitch: 0.6150
[INFO GRT-0088] Layer met4    Track-Pitch = 0.9200  line-2-Via Pitch: 1.0400
[INFO GRT-0088] Layer met5    Track-Pitch = 3.4000  line-2-Via Pitch: 3.1100
[INFO GRT-0019] Found 760 clock nets.
[INFO GRT-0001] Minimum degree: 2
[INFO GRT-0002] Maximum degree: 36
[INFO GRT-0003] Macros: 0
[INFO GRT-0043] No OR_DEFAULT vias defined.
[INFO GRT-0004] Blockages: 9182

[INFO GRT-0053] Routing resources analysis:
          Routing      Original      Derated      Resource
Layer     Direction    Resources     Resources    Reduction (%)
---------------------------------------------------------------
li1        Vertical            0             0          0.00%
met1       Horizontal      37410         17799          52.42%
met2       Vertical        28036         18223          35.00%
met3       Horizontal      18705         12691          32.15%
met4       Vertical        11309          7070          37.48%
met5       Horizontal       3741          1764          52.85%
---------------------------------------------------------------

[INFO GRT-0101] Running extra iterations to remove overflow.
[INFO GRT-0197] Via related to pin nodes: 14307
[INFO GRT-0198] Via related Steiner nodes: 509
[INFO GRT-0199] Via filling finished.
[INFO GRT-0111] Final number of vias: 18579
[INFO GRT-0112] Final usage 3D: 70459

[INFO GRT-0096] Final congestion report:
Layer         Resource        Demand        Usage (%)    Max H / Max V / Total Overflow
---------------------------------------------------------------------------------------
li1                  0             0            0.00%             0 /  0 /  0
met1             17799          6993           39.29%             0 /  0 /  0
met2             18223          6523           35.80%             0 /  0 /  0
met3             12691           876            6.90%             0 /  0 /  0
met4              7070           330            4.67%             0 /  0 /  0
met5              1764             0            0.00%             0 /  0 /  0
---------------------------------------------------------------------------------------
Total            57547         14722           25.58%             0 /  0 /  0

[INFO GRT-0018] Total wirelength: 153476 um
[INFO GRT-0014] Routed nets: 1634
[INFO GRT-0006] Repairing antennas, iteration 1.
[INFO GRT-0043] No OR_DEFAULT vias defined.
[INFO GRT-0012] Found 1 antenna violations.
[INFO GRT-0015] Inserted 1 diodes.
[INFO GRT-0009] rerouting 1202 nets.
[INFO GRT-0001] Minimum degree: 2
[INFO GRT-0002] Maximum degree: 36
[INFO GRT-0006] Repairing antennas, iteration 2.
[INFO GRT-0043] No OR_DEFAULT vias defined.
[INFO GRT-0012] Found 0 antenna violations.
Placement Analysis
---------------------------------
total displacement          0.0 u
average displacement        0.0 u
max displacement            0.0 u
original HPWL           87876.6 u
legalized HPWL          87876.6 u
delta HPWL                    0 %

[INFO DPL-0020] Mirrored 949 instances
[INFO DPL-0021] HPWL before           87876.6 u
[INFO DPL-0022] HPWL after            85582.0 u
[INFO DPL-0023] HPWL delta               -2.6 %
-congestion_iterations 50 -verbose
[INFO GRT-0020] Min routing layer: met1
[INFO GRT-0021] Max routing layer: met5
[INFO GRT-0022] Global adjustment: 30%
[INFO GRT-0023] Grid origin: (0, 0)
[INFO GRT-0043] No OR_DEFAULT vias defined.
[INFO GRT-0088] Layer li1     Track-Pitch = 0.4600  line-2-Via Pitch: 0.3400
[INFO GRT-0088] Layer met1    Track-Pitch = 0.3400  line-2-Via Pitch: 0.3400
[INFO GRT-0088] Layer met2    Track-Pitch = 0.4600  line-2-Via Pitch: 0.3500
[INFO GRT-0088] Layer met3    Track-Pitch = 0.6800  line-2-Via Pitch: 0.6150
[INFO GRT-0088] Layer met4    Track-Pitch = 0.9200  line-2-Via Pitch: 1.0400
[INFO GRT-0088] Layer met5    Track-Pitch = 3.4000  line-2-Via Pitch: 3.1100
[INFO GRT-0019] Found 760 clock nets.
[INFO GRT-0001] Minimum degree: 2
[INFO GRT-0002] Maximum degree: 36
[INFO GRT-0003] Macros: 0
[INFO GRT-0043] No OR_DEFAULT vias defined.
[INFO GRT-0004] Blockages: 9182

[INFO GRT-0053] Routing resources analysis:
          Routing      Original      Derated      Resource
Layer     Direction    Resources     Resources    Reduction (%)
---------------------------------------------------------------
li1        Vertical            0             0          0.00%
met1       Horizontal      37410         17799          52.42%
met2       Vertical        28036         18223          35.00%
met3       Horizontal      18705         12691          32.15%
met4       Vertical        11309          7070          37.48%
met5       Horizontal       3741          1764          52.85%
---------------------------------------------------------------

[INFO GRT-0101] Running extra iterations to remove overflow.
[INFO GRT-0197] Via related to pin nodes: 14300
[INFO GRT-0198] Via related Steiner nodes: 517
[INFO GRT-0199] Via filling finished.
[INFO GRT-0111] Final number of vias: 18577
[INFO GRT-0112] Final usage 3D: 70456

[INFO GRT-0096] Final congestion report:
Layer         Resource        Demand        Usage (%)    Max H / Max V / Total Overflow
---------------------------------------------------------------------------------------
li1                  0             0            0.00%             0 /  0 /  0
met1             17799          7028           39.49%             0 /  0 /  0
met2             18223          6526           35.81%             0 /  0 /  0
met3             12691           836            6.59%             0 /  0 /  0
met4              7070           335            4.74%             0 /  0 /  0
met5              1764             0            0.00%             0 /  0 /  0
---------------------------------------------------------------------------------------
Total            57547         14725           25.59%             0 /  0 /  0

[INFO GRT-0018] Total wirelength: 153545 um
[INFO GRT-0014] Routed nets: 1634
[INFO] Setting RC values…
Setting global connections for newly added cells…
[INFO] Setting global connections...
Writing OpenROAD database to '/Users/junpeng/openlane2/netlist_mid_ad_max/src/netlist_0/runs/physical_design/33-openroad-repairantennas/1-diodeinsertion/netlist_0.odb'…
Writing layout to '/Users/junpeng/openlane2/netlist_mid_ad_max/src/netlist_0/runs/physical_design/33-openroad-repairantennas/1-diodeinsertion/netlist_0.def'…
