Reading OpenROAD database at '/Users/junpeng/openlane2/netlist_mid_ad_min/src/netlist_1/runs/physical_design/32-odb-heuristicdiodeinsertion/3-openroad-globalrouting/netlist_1.odb'…
Reading library file at '/Users/junpeng/.volare/volare/sky130/versions/bdc9412b3e468c102d01b7cf6337be06ec6e9c9a/sky130A/libs.ref/sky130_fd_sc_hd/lib/sky130_fd_sc_hd__tt_025C_1v80.lib'…
Reading design constraints file at '/nix/store/fvqq0703nb8y0f998v8hgg5l6mjj8gb5-python3-3.11.6-env/lib/python3.11/site-packages/openlane/scripts/base.sdc'…
[INFO] Using clock clk…
[INFO] Setting output delay to: 1.6
[INFO] Setting input delay to: 1.6
[INFO] Setting load to: 0.033442
[INFO] Setting clock uncertainty to: 0.25
[INFO] Setting clock transition to: 0.1499999999999999944488848768742172978818416595458984375
[INFO] Setting timing derate to: 5%
[INFO] Setting signal min routing layer to: met1 and clock min routing layer to met1. 
[INFO] Setting signal max routing layer to: met5 and clock max routing layer to met5. 
-congestion_iterations 50 -verbose
[INFO GRT-0020] Min routing layer: met1
[INFO GRT-0021] Max routing layer: met5
[INFO GRT-0022] Global adjustment: 30%
[INFO GRT-0023] Grid origin: (0, 0)
[INFO GRT-0043] No OR_DEFAULT vias defined.
[INFO GRT-0088] Layer li1     Track-Pitch = 0.4600  line-2-Via Pitch: 0.3400
[INFO GRT-0088] Layer met1    Track-Pitch = 0.3400  line-2-Via Pitch: 0.3400
[INFO GRT-0088] Layer met2    Track-Pitch = 0.4600  line-2-Via Pitch: 0.3500
[INFO GRT-0088] Layer met3    Track-Pitch = 0.6800  line-2-Via Pitch: 0.6150
[INFO GRT-0088] Layer met4    Track-Pitch = 0.9200  line-2-Via Pitch: 1.0400
[INFO GRT-0088] Layer met5    Track-Pitch = 3.4000  line-2-Via Pitch: 3.1100
[INFO GRT-0019] Found 35 clock nets.
[INFO GRT-0001] Minimum degree: 2
[INFO GRT-0002] Maximum degree: 34
[INFO GRT-0003] Macros: 0
[INFO GRT-0043] No OR_DEFAULT vias defined.
[INFO GRT-0004] Blockages: 3108

[INFO GRT-0053] Routing resources analysis:
          Routing      Original      Derated      Resource
Layer     Direction    Resources     Resources    Reduction (%)
---------------------------------------------------------------
li1        Vertical            0             0          0.00%
met1       Horizontal      37410         18245          51.23%
met2       Vertical        28036         18201          35.08%
met3       Horizontal      18705         12697          32.12%
met4       Vertical        11309          7070          37.48%
met5       Horizontal       3741          1764          52.85%
---------------------------------------------------------------

[INFO GRT-0197] Via related to pin nodes: 6618
[INFO GRT-0198] Via related Steiner nodes: 218
[INFO GRT-0199] Via filling finished.
[INFO GRT-0111] Final number of vias: 8427
[INFO GRT-0112] Final usage 3D: 32568

[INFO GRT-0096] Final congestion report:
Layer         Resource        Demand        Usage (%)    Max H / Max V / Total Overflow
---------------------------------------------------------------------------------------
li1                  0             0            0.00%             0 /  0 /  0
met1             18245          3790           20.77%             0 /  0 /  0
met2             18201          3423           18.81%             0 /  0 /  0
met3             12697            57            0.45%             0 /  0 /  0
met4              7070            17            0.24%             0 /  0 /  0
met5              1764             0            0.00%             0 /  0 /  0
---------------------------------------------------------------------------------------
Total            57977          7287           12.57%             0 /  0 /  0

[INFO GRT-0018] Total wirelength: 72912 um
[INFO GRT-0014] Routed nets: 1017
[INFO GRT-0006] Repairing antennas, iteration 1.
[INFO GRT-0043] No OR_DEFAULT vias defined.
[INFO GRT-0012] Found 1 antenna violations.
[INFO GRT-0015] Inserted 1 diodes.
[INFO GRT-0009] rerouting 703 nets.
[INFO GRT-0001] Minimum degree: 2
[INFO GRT-0002] Maximum degree: 34
[INFO GRT-0006] Repairing antennas, iteration 2.
[INFO GRT-0043] No OR_DEFAULT vias defined.
[INFO GRT-0012] Found 1 antenna violations.
[INFO GRT-0015] Inserted 1 diodes.
[INFO GRT-0009] rerouting 4 nets.
[INFO GRT-0001] Minimum degree: 3
[INFO GRT-0002] Maximum degree: 19
[INFO GRT-0006] Repairing antennas, iteration 3.
[INFO GRT-0043] No OR_DEFAULT vias defined.
[INFO GRT-0012] Found 0 antenna violations.
Placement Analysis
---------------------------------
total displacement          0.0 u
average displacement        0.0 u
max displacement            0.0 u
original HPWL           45330.9 u
legalized HPWL          45330.9 u
delta HPWL                    0 %

[INFO DPL-0020] Mirrored 553 instances
[INFO DPL-0021] HPWL before           45330.9 u
[INFO DPL-0022] HPWL after            44671.5 u
[INFO DPL-0023] HPWL delta               -1.5 %
-congestion_iterations 50 -verbose
[INFO GRT-0020] Min routing layer: met1
[INFO GRT-0021] Max routing layer: met5
[INFO GRT-0022] Global adjustment: 30%
[INFO GRT-0023] Grid origin: (0, 0)
[INFO GRT-0043] No OR_DEFAULT vias defined.
[INFO GRT-0088] Layer li1     Track-Pitch = 0.4600  line-2-Via Pitch: 0.3400
[INFO GRT-0088] Layer met1    Track-Pitch = 0.3400  line-2-Via Pitch: 0.3400
[INFO GRT-0088] Layer met2    Track-Pitch = 0.4600  line-2-Via Pitch: 0.3500
[INFO GRT-0088] Layer met3    Track-Pitch = 0.6800  line-2-Via Pitch: 0.6150
[INFO GRT-0088] Layer met4    Track-Pitch = 0.9200  line-2-Via Pitch: 1.0400
[INFO GRT-0088] Layer met5    Track-Pitch = 3.4000  line-2-Via Pitch: 3.1100
[INFO GRT-0019] Found 35 clock nets.
[INFO GRT-0001] Minimum degree: 2
[INFO GRT-0002] Maximum degree: 34
[INFO GRT-0003] Macros: 0
[INFO GRT-0043] No OR_DEFAULT vias defined.
[INFO GRT-0004] Blockages: 3108

[INFO GRT-0053] Routing resources analysis:
          Routing      Original      Derated      Resource
Layer     Direction    Resources     Resources    Reduction (%)
---------------------------------------------------------------
li1        Vertical            0             0          0.00%
met1       Horizontal      37410         18245          51.23%
met2       Vertical        28036         18201          35.08%
met3       Horizontal      18705         12697          32.12%
met4       Vertical        11309          7070          37.48%
met5       Horizontal       3741          1764          52.85%
---------------------------------------------------------------

[INFO GRT-0197] Via related to pin nodes: 6627
[INFO GRT-0198] Via related Steiner nodes: 220
[INFO GRT-0199] Via filling finished.
[INFO GRT-0111] Final number of vias: 8443
[INFO GRT-0112] Final usage 3D: 32618

[INFO GRT-0096] Final congestion report:
Layer         Resource        Demand        Usage (%)    Max H / Max V / Total Overflow
---------------------------------------------------------------------------------------
li1                  0             0            0.00%             0 /  0 /  0
met1             18245          3791           20.78%             0 /  0 /  0
met2             18201          3424           18.81%             0 /  0 /  0
met3             12697            57            0.45%             0 /  0 /  0
met4              7070            17            0.24%             0 /  0 /  0
met5              1764             0            0.00%             0 /  0 /  0
---------------------------------------------------------------------------------------
Total            57977          7289           12.57%             0 /  0 /  0

[INFO GRT-0018] Total wirelength: 72946 um
[INFO GRT-0014] Routed nets: 1017
[INFO] Setting RC values…
Setting global connections for newly added cells…
[INFO] Setting global connections...
Writing OpenROAD database to '/Users/junpeng/openlane2/netlist_mid_ad_min/src/netlist_1/runs/physical_design/33-openroad-repairantennas/1-diodeinsertion/netlist_1.odb'…
Writing layout to '/Users/junpeng/openlane2/netlist_mid_ad_min/src/netlist_1/runs/physical_design/33-openroad-repairantennas/1-diodeinsertion/netlist_1.def'…
